,Title,World Sales,Year Released,Rotten Tomatoes Score,IMDB Score,Director(s),Headlining Actor(s),Studio,Runtime,Rating,Genre
560,Jungle Cruise,365551694,2021,63%,6.6,Jaume Collet-Serra,"Dwayne Johnson, Emily Blunt, Edgar Ramírez",Warner Bros.,127 min,PG-13,"['Horror', 'Mystery', 'Thriller']"
561,S.W.A.T.,171685792,2003,48%,6.0,Clark Johnson,"Samuel L. Jackson, Colin Farrell, Michelle Rodriguez",Paramount Pictures,117 min,PG-13,"['Action', 'Comedy', 'Documentary']"
562,The Wolf of Wall Street,311312624,2013,80%,8.2,Martin Scorsese,"Leonardo DiCaprio, Jonah Hill, Margot Robbie",Warner Bros.,180 min,R,"['Crime', 'Thriller']"
563,8 Mile,220889446,2002,75%,7.2,Curtis Hanson,"Eminem, Brittany Murphy, Kim Basinger",Walt Disney Studios Motion Pictures,110 min,R,"['Action', 'Adventure', 'Comedy', 'Fantasy']"
564,Double Jeopardy,207725639,1999,28%,6.5,Bruce Beresford,"Ashley Judd, Tommy Lee Jones, Bruce Greenwood",Sony Pictures Entertainment (SPE),105 min,R,"['Action', 'Adventure', 'Crime', 'Thriller']"
565,Green Lantern,392000694,2011,26%,5.5,Martin Campbell,"Ryan Reynolds, Blake Lively, Peter Sarsgaard",Paramount Pictures,114 min,PG-13,"['Biography', 'Comedy', 'Crime', 'Drama']"
566,Notting Hill,242875078,1999,84%,7.2,Roger Michell,"Hugh Grant, Julia Roberts, Richard McCabe",Universal Pictures,124 min,PG-13,"['Drama', 'Music']"
567,You've Got Mail,177841558,1998,70%,6.7,Nora Ephron,"Tom Hanks, Meg Ryan, Greg Kinnear",Paramount Pictures,119 min,PG,"['Crime', 'Drama', 'Mystery', 'Thriller']"
568,Ghost Rider,177313795,2007,27%,5.2,Mark Steven Johnson,"Nicolas Cage, Eva Mendes, Sam Elliott",The Weinstein Company,110 min,PG-13,"['Biography', 'Drama']"
569,Remember the Titans,219851172,2000,72%,7.8,Boaz Yakin,"Denzel Washington, Will Patton, Wood Harris",Warner Bros.,113 min,PG,"['Action', 'Adventure', 'Sci-Fi']"
570,Creed II,363889678,2018,83%,7.1,Steven Caple Jr.,"Michael B. Jordan, Sylvester Stallone, Tessa Thompson",Universal Pictures,130 min,PG-13,"['Comedy', 'Drama', 'Romance']"
571,District 9,250821495,2009,90%,7.9,Neill Blomkamp,"Sharlto Copley, David James, Jason Cope",Warner Bros.,112 min,R,"['Comedy', 'Drama', 'Romance']"
572,Unbroken,228738393,2014,52%,7.2,Angelina Jolie,"Jack O'Connell, Miyavi, Domhnall Gleeson",Sony Pictures Entertainment (SPE),137 min,PG-13,"['Action', 'Fantasy', 'Thriller']"
573,Peter Rabbit,136771683,2018,63%,6.6,Will Gluck,"James Corden, Fayssal Bazzi, Domhnall Gleeson",Walt Disney Studios Motion Pictures,95 min,PG,"['Biography', 'Drama', 'Sport']"
574,Girls Trip,214215889,2017,92%,6.2,Malcolm D. Lee,"Regina Hall, Queen Latifah, Jada Pinkett Smith",Metro-Goldwyn-Mayer (MGM),122 min,R,"['Drama', 'Sport']"
575,Dumbo,210888950,1941,98%,7.2,"Samuel Armstrong, Norman Ferguson, Wilfred Jackson","Sterling Holloway, Edward Brophy, Herman Bing",TriStar Pictures,64 min,G,"['Action', 'Sci-Fi', 'Thriller']"
576,Fifty Shades Darker,161459297,2017,11%,4.6,James Foley,"Dakota Johnson, Jamie Dornan, Eric Johnson",Universal Pictures,118 min,R,"['Action', 'Biography', 'Drama', 'Sport', 'War']"
577,Dodgeball: A True Underdog Story,351496066,2004,71%,6.7,Rawson Marshall Thurber,"Ben Stiller, Christine Taylor, Vince Vaughn",Sony Pictures Entertainment (SPE),92 min,PG-13,"['Adventure', 'Animation', 'Comedy', 'Crime', 'Drama', 'Family', 'Fantasy']"
578,The Village,140552359,2004,43%,6.6,M. Night Shyamalan,"Sigourney Weaver, William Hurt, Joaquin Phoenix",Universal Pictures,108 min,PG-13,"['Adventure', 'Comedy', 'Drama']"
579,Bolt,353284621,2008,90%,6.8,"Byron Howard, Chris Williams","John Travolta, Miley Cyrus, Susie Essman",Walt Disney Studios Motion Pictures,96 min,PG,"['Adventure', 'Family', 'Fantasy']"
580,Maleficent: Mistress of Evil,381545846,2019,39%,6.6,Joachim Rønning,"Angelina Jolie, Elle Fanning, Harris Dickinson",Universal Pictures,119 min,PG,"['Drama', 'Romance']"
581,Wild Wild West,168423227,1999,16%,4.9,Barry Sonnenfeld,"Will Smith, Kevin Kline, Kenneth Branagh",Twentieth Century Fox,106 min,PG-13,"['Comedy', 'Sport']"
582,Night at the Museum: Secret of the Tomb,256697520,2014,47%,6.2,Shawn Levy,"Ben Stiller, Robin Williams, Owen Wilson",Walt Disney Studios Motion Pictures,98 min,PG,"['Drama', 'Mystery', 'Thriller']"
583,Magic Mike,309979994,2012,78%,6.1,Steven Soderbergh,"Channing Tatum, Alex Pettyfer, Olivia Munn",Walt Disney Studios Motion Pictures,110 min,R,"['Adventure', 'Animation', 'Comedy', 'Crime', 'Drama', 'Family', 'Sci-Fi']"
584,The Addams Family,491730089,1991,67%,6.9,Barry Sonnenfeld,"Anjelica Huston, Raul Julia, Christopher Lloyd",Walt Disney Studios Motion Pictures,99 min,PG-13,"['Adventure', 'Family', 'Fantasy']"
585,The Patriot,222104681,2000,62%,7.2,Roland Emmerich,"Mel Gibson, Heath Ledger, Joely Richardson",Warner Bros.,165 min,R,"['Action', 'Comedy', 'Sci-Fi', 'Western']"
586,Bad Moms,363204635,2016,58%,6.2,"Jon Lucas, Scott Moore","Mila Kunis, Kathryn Hahn, Kristen Bell",Twentieth Century Fox,100 min,R,"['Adventure', 'Comedy', 'Family', 'Fantasy']"
587,The Bourne Legacy,167739961,2012,55%,6.6,Tony Gilroy,"Jeremy Renner, Rachel Weisz, Edward Norton",Warner Bros.,135 min,PG-13,"['Comedy', 'Drama']"
588,The Pacifier,191502426,2005,21%,5.6,Adam Shankman,"Vin Diesel, Brittany Snow, Max Thieriot",Paramount Pictures,95 min,PG,"['Comedy', 'Fantasy']"
589,Dr. Dolittle 2,215294342,2001,42%,4.7,Steve Carr,"Eddie Murphy, Cedric the Entertainer, Kristen Wilson",Sony Pictures Entertainment (SPE),87 min,PG,"['Action', 'Drama', 'History', 'War']"
590,It's Complicated,183936074,2009,59%,6.5,Nancy Meyers,"Meryl Streep, Steve Martin, Alec Baldwin",STX Entertainment,120 min,R,['Comedy']
591,Spy Kids,276144750,2001,93%,5.6,Robert Rodriguez,"Alexa PenaVega, Daryl Sabara, Antonio Banderas",Universal Pictures,88 min,PG,"['Action', 'Adventure', 'Thriller']"
592,Face/Off,198636868,1997,92%,7.3,John Woo,"John Travolta, Nicolas Cage, Joan Allen",Walt Disney Studios Motion Pictures,138 min,R,"['Action', 'Comedy', 'Drama', 'Family']"
593,The Hangover Part III,176104344,2013,20%,5.8,Todd Phillips,"Bradley Cooper, Zach Galifianakis, Ed Helms",Twentieth Century Fox,100 min,R,"['Comedy', 'Family', 'Fantasy']"
594,Twins,219103655,1988,42%,6.1,Ivan Reitman,"Arnold Schwarzenegger, Danny DeVito, Kelly Preston",Universal Pictures,107 min,PG,"['Comedy', 'Drama', 'Romance']"
595,Enemy of the State,147934180,1998,70%,7.3,Tony Scott,"Will Smith, Gene Hackman, Jon Voight",Miramax,132 min,R,"['Action', 'Adventure', 'Comedy', 'Family', 'Sci-Fi']"
596,Mr. Peabody & Sherman,245676146,2014,81%,6.8,Rob Minkoff,"Ty Burrell, Max Charles, Stephen Colbert",Paramount Pictures,92 min,PG,"['Action', 'Crime', 'Sci-Fi', 'Thriller']"
597,The Last Samurai,362000072,2003,66%,7.8,Edward Zwick,"Tom Cruise, Ken Watanabe, Billy Connolly",Warner Bros.,154 min,R,"['Comedy', 'Crime']"
598,Glass,216614388,2019,36%,6.6,M. Night Shyamalan,"James McAvoy, Bruce Willis, Samuel L. Jackson",Universal Pictures,129 min,PG-13,"['Comedy', 'Crime']"
599,Spy,197101678,2015,95%,7.0,Paul Feig,"Melissa McCarthy, Rose Byrne, Jude Law",Dimension Films,120 min,R,"['Action', 'Adventure', 'Comedy', 'Family', 'Sci-Fi']"
600,Sing 2,250849789,2021,72%,7.4,"Garth Jennings, Christophe Lourdelet","Matthew McConaughey, Reese Witherspoon, Scarlett Johansson",Walt Disney Studios Motion Pictures,110 min,PG,"['Action', 'Thriller']"
601,Tropic Thunder,275698039,2008,82%,7.0,Ben Stiller,"Ben Stiller, Jack Black, Robert Downey Jr.",Twentieth Century Fox,107 min,R,"['Adventure', 'Animation', 'Comedy', 'Family', 'Fantasy', 'History', 'Sci-Fi']"
602,Godzilla: King of the Monsters,454627263,2019,42%,6.0,Michael Dougherty,"Kyle Chandler, Vera Farmiga, Millie Bobby Brown",Warner Bros.,132 min,PG-13,"['Action', 'Drama']"
603,Valentine's Day,246999039,2010,18%,5.7,Garry Marshall,"Julia Roberts, Jamie Foxx, Anne Hathaway",Universal Pictures,125 min,PG-13,"['Drama', 'Sci-Fi', 'Thriller']"
604,The Grudge,235666219,2004,40%,5.9,Takashi Shimizu,"Sarah Michelle Gellar, Jason Behr, Clea DuVall",Twentieth Century Fox,91 min,PG-13,"['Action', 'Comedy']"
605,Fun with Dick and Jane,192669715,2005,29%,6.2,Dean Parisot,"Jim Carrey, Téa Leoni, Alec Baldwin",Universal Pictures,90 min,PG-13,"['Adventure', 'Animation', 'Comedy', 'Family', 'Music', 'Musical']"
606,Freaky Friday,195702963,2003,88%,6.3,Mark Waters,"Jamie Lee Curtis, Lindsay Lohan, Mark Harmon",DreamWorks,97 min,PG,"['Action', 'Comedy', 'War']"
607,Trainwreck,386600138,2015,84%,6.2,Judd Apatow,"Amy Schumer, Bill Hader, Brie Larson",Warner Bros.,125 min,R,"['Action', 'Adventure', 'Fantasy', 'Sci-Fi']"
608,Bedtime Stories,216485654,2008,27%,6.0,Adam Shankman,"Adam Sandler, Keri Russell, Courteney Cox",Warner Bros.,99 min,PG,"['Comedy', 'Romance']"
609,Scary Movie 3,187281115,2003,35%,5.5,David Zucker,"Anna Faris, Charlie Sheen, Regina Hall",Sony Pictures Entertainment (SPE),84 min,PG-13,"['Horror', 'Mystery', 'Thriller']"
610,Creed,204681899,2015,95%,7.6,Ryan Coogler,"Michael B. Jordan, Sylvester Stallone, Tessa Thompson",Sony Pictures Entertainment (SPE),133 min,PG-13,"['Comedy', 'Crime']"
611,Star Trek IV: The Voyage Home,160846332,1986,82%,7.3,Leonard Nimoy,"William Shatner, Leonard Nimoy, DeForest Kelley",Walt Disney Studios Motion Pictures,119 min,PG,"['Comedy', 'Family', 'Fantasy', 'Music', 'Romance']"
612,The 40-Year-Old Virgin,140795793,2005,85%,7.1,Judd Apatow,"Steve Carell, Catherine Keener, Paul Rudd",Universal Pictures,116 min,R,"['Comedy', 'Drama', 'Romance']"
613,Couples Retreat,212874864,2009,10%,5.5,Peter Billingsley,"Vince Vaughn, Malin Akerman, Jon Favreau",Walt Disney Studios Motion Pictures,113 min,PG-13,"['Adventure', 'Comedy', 'Family', 'Fantasy', 'Romance', 'Sci-Fi']"
614,A Time to Kill,220673217,1996,68%,7.5,Joel Schumacher,"Matthew McConaughey, Sandra Bullock, Samuel L. Jackson",Dimension Films,149 min,R,['Comedy']
615,Black Hawk Down,173567581,2001,77%,7.7,Ridley Scott,"Josh Hartnett, Ewan McGregor, Tom Sizemore",Warner Bros.,144 min,R,"['Action', 'Drama', 'Sport']"
616,Terms of Endearment,109713132,1983,81%,7.4,James L. Brooks,"Shirley MacLaine, Debra Winger, Jack Nicholson",Paramount Pictures,132 min,PG,"['Action', 'Adventure', 'Comedy', 'Sci-Fi']"
617,Ace Ventura: When Nature Calls,177378645,1995,21%,6.4,Steve Oedekerk,"Jim Carrey, Ian McNeice, Simon Callow",Universal Pictures,90 min,PG-13,"['Comedy', 'Romance']"
618,The Upside,171844840,2017,46/100,7.0,Neil Burger,"Kevin Hart, Bryan Cranston, Nicole Kidman",Universal Pictures,126 min,PG-13,['Comedy']
619,The Princess Diaries,152266007,2001,49%,6.3,Garry Marshall,"Julie Andrews, Anne Hathaway, Hector Elizondo",Warner Bros.,115 min,G,"['Crime', 'Drama', 'Thriller']"
620,Superman II,172989651,1980,83%,6.8,"Richard Lester, Richard Donner","Gene Hackman, Christopher Reeve, Margot Kidder",Revolution Studios,127 min,PG,"['Action', 'Drama', 'History', 'War']"
621,Little Women,108423749,2019,95%,7.8,Greta Gerwig,"Saoirse Ronan, Emma Watson, Florence Pugh",Paramount Pictures,135 min,PG,"['Comedy', 'Drama']"
622,Hop,212385533,2011,24%,5.4,Tim Hill,"Russell Brand, James Marsden, Elizabeth Perkins",Warner Bros.,95 min,PG,"['Adventure', 'Comedy', 'Crime']"
623,Pulp Fiction,125856180,1994,92%,8.9,Quentin Tarantino,"John Travolta, Uma Thurman, Samuel L. Jackson",STX Entertainment,154 min,R,"['Comedy', 'Drama']"
624,Paranormal Activity,165335153,2007,83%,6.3,Oren Peli,"Katie Featherston, Micah Sloat, Mark Fredrichs",Walt Disney Studios Motion Pictures,86 min,R,"['Comedy', 'Family', 'Romance']"
625,Baby Driver,108185706,2017,92%,7.6,Edgar Wright,"Ansel Elgort, Jon Bernthal, Jon Hamm",Warner Bros.,113 min,R,"['Action', 'Adventure', 'Sci-Fi']"
626,A League of Their Own,216601214,1992,81%,7.3,Penny Marshall,"Tom Hanks, Geena Davis, Lori Petty",Sony Pictures Entertainment (SPE),128 min,PG,"['Drama', 'Romance']"
627,Epic,183954145,2013,64%,6.6,Chris Wedge,"Amanda Seyfried, Josh Hutcherson, Beyoncé",Universal Pictures,102 min,PG,"['Adventure', 'Animation', 'Comedy', 'Family', 'Fantasy']"
628,Watchmen,213928762,2009,65%,7.6,Zack Snyder,"Jackie Earle Haley, Patrick Wilson, Carla Gugino",Miramax,162 min,R,"['Crime', 'Drama']"
629,The Angry Birds Movie,193355800,2016,43%,6.3,"Clay Kaytis, Fergal Reilly","Jason Sudeikis, Josh Gad, Danny McBride",Paramount Pictures,97 min,PG,"['Horror', 'Mystery']"
630,Batman & Robin,226945087,1989,73%,7.5,Tim Burton,"Michael Keaton, Jack Nicholson, Kim Basinger",TriStar Pictures,126 min,PG-13,"['Action', 'Crime', 'Drama', 'Music', 'Thriller']"
631,Dune,132440069,2021,83%,8.0,Denis Villeneuve,"Timothée Chalamet, Rebecca Ferguson, Zendaya",Sony Pictures Entertainment (SPE),155 min,PG-13,"['Comedy', 'Drama', 'Sport']"
632,Captain Phillips,268426634,2013,93%,7.8,Paul Greengrass,"Tom Hanks, Barkhad Abdi, Barkhad Abdirahman",Twentieth Century Fox,134 min,PG-13,"['Action', 'Adventure', 'Animation', 'Family', 'Fantasy', 'Mystery']"
633,Black Swan,185382813,2010,85%,8.0,Darren Aronofsky,"Natalie Portman, Mila Kunis, Vincent Cassel",Warner Bros.,108 min,R,"['Action', 'Drama', 'Mystery', 'Sci-Fi']"
634,Analyze This,352333929,1999,69%,6.7,Harold Ramis,"Robert De Niro, Billy Crystal, Lisa Kudrow",Sony Pictures Entertainment (SPE),103 min,R,"['Action', 'Adventure', 'Animation', 'Comedy', 'Family']"
635,Chicken Run,238235719,2000,97%,7.1,"Peter Lord, Nick Park","Mel Gibson, Julia Sawalha, Phil Daniels",Warner Bros.,84 min,G,"['Action', 'Sci-Fi']"
636,Miss Congeniality,397044390,2000,41%,6.3,Donald Petrie,"Sandra Bullock, Michael Caine, Benjamin Bratt",Warner Bros.,109 min,PG-13,"['Action', 'Adventure', 'Drama', 'Sci-Fi']"
637,Indecent Proposal,218791811,1993,34%,6.0,Adrian Lyne,"Robert Redford, Demi Moore, Woody Harrelson",Sony Pictures Entertainment (SPE),117 min,R,"['Action', 'Biography', 'Crime', 'Drama', 'Thriller']"
638,300: Rise of an Empire,329398046,2014,45%,6.2,Noam Murro,"Sullivan Stapleton, Eva Green, Lena Headey",Fox Searchlight Pictures,102 min,R,"['Drama', 'Thriller']"
639,GoldenEye,176885658,1995,80%,7.2,Martin Campbell,"Pierce Brosnan, Sean Bean, Izabella Scorupco",Warner Bros.,130 min,PG-13,"['Comedy', 'Crime']"
640,The Italian Job,224834564,2003,72%,7.0,F. Gary Gray,"Donald Sutherland, Mark Wahlberg, Edward Norton",DreamWorks Distribution,111 min,PG-13,"['Adventure', 'Animation', 'Comedy', 'Drama', 'Family']"
641,How to Lose a Guy in 10 Days,212742720,2003,42%,6.4,Donald Petrie,"Kate Hudson, Matthew McConaughey, Adam Goldberg",Warner Bros.,116 min,PG-13,"['Action', 'Comedy', 'Crime', 'Romance']"
642,The Lego Movie 2: The Second Part,266614059,2019,84%,6.6,Mike Mitchell,"Chris Pratt, Elizabeth Banks, Will Arnett",Paramount Pictures,107 min,PG,"['Drama', 'Romance']"
643,The First Wives Club,337580051,1996,50%,6.4,Hugh Wilson,"Goldie Hawn, Bette Midler, Diane Keaton",Warner Bros.,103 min,PG,"['Action', 'Drama']"
644,Robin Hood,352194034,2010,43%,6.6,Ridley Scott,"Russell Crowe, Cate Blanchett, Matthew Macfadyen",Metro-Goldwyn-Mayer (MGM),140 min,PG-13,"['Action', 'Adventure', 'Thriller']"
645,Interview with the Vampire: The Vampire Chronicles,176070171,1994,64%,7.5,Neil Jordan,"Brad Pitt, Tom Cruise, Antonio Banderas",Paramount Pictures,123 min,R,"['Action', 'Crime', 'Thriller']"
646,George of the Jungle,177502387,1997,55%,5.5,Sam Weisman,"Brendan Fraser, Leslie Mann, Thomas Haden Church",Paramount Pictures,92 min,PG,"['Comedy', 'Romance']"
647,Hustlers,192306508,2019,87%,6.3,Lorene Scafaria,"Constance Wu, Jennifer Lopez, Julia Stiles",Warner Bros.,110 min,R,"['Adventure', 'Animation', 'Comedy', 'Family', 'Fantasy', 'Sci-Fi']"
648,Pitch Perfect 3,181489203,2017,28%,5.8,Trish Sie,"Anna Kendrick, Rebel Wilson, Brittany Snow",Paramount Pictures,93 min,PG-13,['Comedy']
649,Phenomenon,321669741,1996,49%,6.4,Jon Turteltaub,"John Travolta, Kyra Sedgwick, Forest Whitaker",Universal Pictures,123 min,PG,"['Action', 'Adventure', 'Drama', 'History']"
650,American Wedding,223664608,2003,53%,6.3,Jesse Dylan,"Jason Biggs, Alyson Hannigan, Seann William Scott",Warner Bros.,96 min,R,"['Drama', 'Fantasy', 'Horror']"
651,Road to Perdition,174463257,2002,81%,7.7,Sam Mendes,"Tom Hanks, Tyler Hoechlin, Rob Maxey",Walt Disney Studios Motion Pictures,117 min,R,"['Action', 'Adventure', 'Comedy', 'Family', 'Romance']"
652,The Princess and the Frog,157563598,2009,85%,7.1,"Ron Clements, John Musker","Anika Noni Rose, Keith David, Oprah Winfrey",STX Entertainment,97 min,G,"['Comedy', 'Crime', 'Drama']"
653,The Chronicles of Narnia: The Voyage of the Dawn Treader,185400345,2010,50%,6.3,Michael Apted,"Ben Barnes, Skandar Keynes, Georgie Henley",Universal Pictures,113 min,PG,"['Comedy', 'Music']"
654,Daddy Day Care,152036382,2003,27%,5.6,Steve Carr,"Eddie Murphy, Jeff Garlin, Anjelica Huston",Walt Disney Studios Motion Pictures,92 min,PG,"['Drama', 'Fantasy', 'Romance', 'Sci-Fi']"
655,Daddy's Home 2,232722935,2017,21%,6.0,Sean Anders,"Will Ferrell, Mark Wahlberg, Mel Gibson",Universal Pictures,100 min,PG-13,['Comedy']
656,Paranormal Activity 3,181001478,2011,66%,5.8,"Henry Joost, Ariel Schulman","Chloe Csengery, Jessica Tyler Brown, Christopher Nicholas Smith",DreamWorks Distribution,83 min,R,"['Crime', 'Drama', 'Thriller']"
657,Journey 2: The Mysterious Island,267045765,2012,45%,5.7,Brad Peyton,"Josh Hutcherson, Dwayne Johnson, Michael Caine",Walt Disney Studios Motion Pictures,94 min,PG,"['Adventure', 'Animation', 'Comedy', 'Family', 'Fantasy', 'Musical', 'Romance']"
658,The Mule,415686217,2018,70%,7.0,Clint Eastwood,"Clint Eastwood, Patrick L. Reyes, Cesar De León",Twentieth Century Fox,116 min,R,"['Adventure', 'Family', 'Fantasy']"
659,Dick Tracy,164433867,1990,63%,6.2,Warren Beatty,"Warren Beatty, Madonna, Al Pacino",Revolution Studios,105 min,PG,"['Comedy', 'Family']"
660,Rise of the Guardians,180613824,2012,74%,7.2,Peter Ramsey,"Hugh Jackman, Alec Baldwin, Isla Fisher",Paramount Pictures,97 min,PG,['Comedy']
661,Dreamgirls,207039844,2006,79%,6.6,Bill Condon,"Beyoncé, Jamie Foxx, Eddie Murphy",Paramount Pictures,130 min,PG-13,"['Horror', 'Mystery']"
662,Independence Day: Resurgence,335260290,2016,29%,5.2,Roland Emmerich,"Liam Hemsworth, Jeff Goldblum, Bill Pullman",Warner Bros.,120 min,PG-13,"['Action', 'Adventure', 'Comedy', 'Family', 'Fantasy', 'Sci-Fi']"
663,The Expendables,174804407,2010,42%,6.4,Sylvester Stallone,"Sylvester Stallone, Jason Statham, Jet Li",Warner Bros.,103 min,R,"['Crime', 'Drama', 'Thriller']"
664,Scream,162738726,1996,80%,7.4,Wes Craven,"Neve Campbell, Courteney Cox, David Arquette",Walt Disney Studios Motion Pictures,111 min,R,"['Action', 'Comedy', 'Crime', 'Music', 'Romance', 'Thriller']"
665,Just Go with It,306941670,2011,19%,6.4,Dennis Dugan,"Adam Sandler, Jennifer Aniston, Brooklyn Decker",DreamWorks,117 min,PG-13,"['Action', 'Adventure', 'Animation', 'Comedy', 'Drama', 'Family', 'Fantasy']"
666,Murder on the Orient Express,155430335,2017,61%,6.5,Kenneth Branagh,"Kenneth Branagh, Penélope Cruz, Willem Dafoe",DreamWorks,114 min,PG-13,"['Drama', 'Music', 'Musical']"
667,The General's Daughter,389681935,1999,21%,6.4,Simon West,"John Travolta, Madeleine Stowe, James Cromwell",Twentieth Century Fox,116 min,R,"['Action', 'Adventure', 'Sci-Fi']"
668,The Aviator,274470394,2004,86%,7.5,Martin Scorsese,"Leonardo DiCaprio, Cate Blanchett, Kate Beckinsale",Lionsgate,170 min,PG-13,"['Action', 'Adventure', 'Thriller']"
669,American Pie,173046663,1999,61%,7.0,"Paul Weitz, Chris Weitz","Jason Biggs, Chris Klein, Thomas Ian Nicholas",Dimension Films,95 min,R,"['Horror', 'Mystery']"
670,The Girl with the Dragon Tattoo,214945591,2011,86%,7.8,David Fincher,"Daniel Craig, Rooney Mara, Christopher Plummer",Sony Pictures Entertainment (SPE),158 min,R,"['Comedy', 'Romance']"
671,The Mummy: Tomb of the Dragon Emperor,352794081,2008,13%,5.2,Rob Cohen,"Brendan Fraser, Jet Li, Maria Bello",Twentieth Century Fox,112 min,PG-13,"['Crime', 'Drama', 'Mystery']"
672,The Conjuring 2,149705852,2016,80%,7.3,James Wan,"Vera Farmiga, Patrick Wilson, Madison Wolfe",Paramount Pictures,134 min,R,"['Crime', 'Drama', 'Mystery', 'Thriller']"
673,The Maze Runner,213719942,2014,65%,6.8,Wes Ball,"Dylan O'Brien, Kaya Scodelario, Will Poulter",Miramax,113 min,PG-13,"['Biography', 'Drama']"
674,In the Line of Fire,235483004,1993,96%,7.2,Wolfgang Petersen,"Clint Eastwood, John Malkovich, Rene Russo",Universal Pictures,128 min,R,['Comedy']
675,Annabelle: Creation,179179718,2017,70%,6.5,David F. Sandberg,"Anthony LaPaglia, Samara Lee, Miranda Otto",Twentieth Century Fox,109 min,R,"['Action', 'Crime']"
676,The Equalizer 2,232617430,2018,52%,6.7,Antoine Fuqua,"Denzel Washington, Pedro Pascal, Ashton Sanders",Sony Pictures Entertainment (SPE),121 min,R,"['Crime', 'Drama', 'Mystery', 'Thriller']"
677,Bad Grandpa,403449830,2013,61%,6.5,Jeff Tremaine,"Johnny Knoxville, Jackson Nicoll, Gregorio",Universal Pictures,92 min,R,"['Action', 'Fantasy', 'Horror', 'War']"
678,Pacific Rim,321788219,2013,72%,6.9,Guillermo del Toro,"Idris Elba, Charlie Hunnam, Rinko Kikuchi",Warner Bros.,131 min,PG-13,"['Horror', 'Mystery', 'Thriller']"
679,Journey to the Center of the Earth,348319861,2008,61%,5.8,Eric Brevig,"Brendan Fraser, Josh Hutcherson, Anita Briem",Twentieth Century Fox,93 min,PG,"['Action', 'Mystery', 'Sci-Fi', 'Thriller']"
680,Gone in 60 Seconds,176997168,2000,25%,6.5,Dominic Sena,"Nicolas Cage, Angelina Jolie, Giovanni Ribisi",Columbia Pictures,118 min,PG-13,"['Action', 'Crime', 'Drama', 'Thriller']"
681,Maverick,306515884,1994,67%,7.0,Richard Donner,"Mel Gibson, Jodie Foster, James Garner",Warner Bros.,127 min,PG,"['Horror', 'Mystery', 'Thriller']"
682,Sleeping with the Enemy,190400157,1991,22%,6.2,Joseph Ruben,"Julia Roberts, Patrick Bergin, Kevin Anderson",Sony Pictures Entertainment (SPE),99 min,R,"['Action', 'Crime', 'Thriller']"
683,The Equalizer,151826547,2014,60%,7.2,Antoine Fuqua,"Denzel Washington, Marton Csokas, Chloë Grace Moretz",Paramount Pictures,132 min,R,['Comedy']
684,This Is the End,411002906,2013,83%,6.6,"Evan Goldberg, Seth Rogen","James Franco, Jonah Hill, Seth Rogen",Warner Bros.,107 min,R,"['Action', 'Adventure', 'Sci-Fi']"
685,Eagle Eye,244232688,2008,26%,6.6,D.J. Caruso,"Shia LaBeouf, Michelle Monaghan, Rosario Dawson",Warner Bros.,118 min,PG-13,"['Action', 'Adventure', 'Family', 'Fantasy', 'Sci-Fi']"
686,The Prince of Egypt,237202299,1998,79%,7.1,"Brenda Chapman, Steve Hickner, Simon Wells","Val Kilmer, Ralph Fiennes, Michelle Pfeiffer",Walt Disney Studios Motion Pictures,99 min,PG,"['Action', 'Crime', 'Thriller']"
687,Scream 2,183031272,1997,82%,6.3,Wes Craven,"Neve Campbell, Courteney Cox, David Arquette",Warner Bros.,120 min,R,"['Action', 'Adventure', 'Comedy', 'Thriller', 'Western']"
688,Eraser,174999005,1996,42%,6.2,Chuck Russell,"Arnold Schwarzenegger, Vanessa Williams, James Caan",Twentieth Century Fox,115 min,R,"['Drama', 'Thriller']"
689,Noah,192330738,2014,75%,5.8,Darren Aronofsky,"Russell Crowe, Jennifer Connelly, Anthony Hopkins",Sony Pictures Entertainment (SPE),138 min,PG-13,"['Action', 'Crime', 'Thriller']"
690,Unforgiven,126041322,1992,96%,8.2,Clint Eastwood,"Clint Eastwood, Gene Hackman, Morgan Freeman",Sony Pictures Entertainment (SPE),130 min,R,['Comedy']
691,The Cat in the Hat,178767383,2003,10%,4.0,Bo Welch,"Mike Myers, Spencer Breslin, Dakota Fanning",DreamWorks,82 min,PG,"['Action', 'Mystery', 'Thriller']"
692,Con Air,218613188,1997,58%,6.9,Simon West,"Nicolas Cage, John Cusack, John Malkovich",DreamWorks Distribution,115 min,R,"['Adventure', 'Animation', 'Drama', 'Family', 'Fantasy', 'Musical']"
693,Sleepy Hollow,172363301,1999,70%,7.3,Tim Burton,"Johnny Depp, Christina Ricci, Miranda Richardson",Dimension Films,105 min,R,"['Horror', 'Mystery']"
694,Rampage,242295562,2018,51%,6.1,Brad Peyton,"Dwayne Johnson, Naomie Harris, Malin Akerman",Warner Bros.,107 min,PG-13,"['Action', 'Crime', 'Thriller']"
695,Collateral,359200044,2004,86%,7.5,Michael Mann,"Tom Cruise, Jamie Foxx, Jada Pinkett Smith",Paramount Pictures,120 min,R,"['Action', 'Adventure', 'Drama']"
696,Contact,159157447,1997,68%,7.5,Robert Zemeckis,"Jodie Foster, Matthew McConaughey, Tom Skerritt",Warner Bros.,150 min,PG,"['Drama', 'Western']"
697,Charlie's Angels: Full Throttle,133960541,2003,41%,4.9,McG,"Drew Barrymore, Lucy Liu, Cameron Diaz",Universal Pictures,106 min,PG-13,"['Adventure', 'Comedy', 'Family', 'Fantasy']"
698,The Pelican Brief,224012234,1993,54%,6.6,Alan J. Pakula,"Julia Roberts, Denzel Washington, Sam Shepard",Walt Disney Studios Motion Pictures,141 min,PG-13,"['Action', 'Crime', 'Thriller']"
699,The Addams Family,206071502,1991,67%,6.9,Barry Sonnenfeld,"Anjelica Huston, Raul Julia, Christopher Lloyd",Paramount Pictures,99 min,PG-13,"['Fantasy', 'Horror', 'Mystery']"
700,Vanilla Sky,428028233,2001,43%,6.9,Cameron Crowe,"Tom Cruise, Penélope Cruz, Cameron Diaz",Warner Bros.,136 min,R,"['Action', 'Adventure', 'Sci-Fi']"
701,Godzilla vs. Kong,220239925,2021,75%,6.3,Adam Wingard,"Alexander Skarsgård, Millie Bobby Brown, Rebecca Hall",DreamWorks Distribution,113 min,PG-13,"['Action', 'Crime', 'Drama', 'Thriller']"
702,Arrival,171120329,2016,95%,7.9,Denis Villeneuve,"Amy Adams, Jeremy Renner, Forest Whitaker",Warner Bros.,116 min,PG-13,"['Drama', 'Mystery', 'Sci-Fi', 'Thriller']"
703,Due Date,259175788,2010,39%,6.5,Todd Phillips,"Robert Downey Jr., Zach Galifianakis, Michelle Monaghan",Sony Pictures Entertainment (SPE),95 min,R,"['Action', 'Adventure', 'Comedy', 'Crime']"
704,Jumanji,195268056,1995,52%,7.0,Joe Johnston,"Robin Williams, Kirsten Dunst, Bonnie Hunt",Warner Bros.,104 min,PG,"['Crime', 'Drama', 'Mystery', 'Thriller']"
705,The Rugrats Movie,203783845,1998,59%,5.9,"Igor Kovalyov, Norton Virgien","Elizabeth Daily, Christine Cavanaugh, Kath Soucie",United Artists Releasing,79 min,G,"['Animation', 'Comedy', 'Family', 'Fantasy', 'Horror']"
706,Million Dollar Baby,203388341,2004,90%,8.1,Clint Eastwood,"Hilary Swank, Clint Eastwood, Morgan Freeman",Paramount Pictures,132 min,PG-13,"['Fantasy', 'Mystery', 'Romance', 'Sci-Fi', 'Thriller']"
